Contact1 First Name,Contact1 Last Name,Account1 Name,Donation Amount,Donation Date,Donation Name,Donation Stage,Donation Campaign Name,Payment Method,Donation Description,Donation Donor,NPSP Data Import Batch
,,Philadelphia Tech Solutions Inc,25000,2024-02-15,Tech Solutions Annual Sponsorship 2024,Closed Won,Annual Fund 2024,Check,Corporate sponsorship including employee volunteer program and matching gifts,Account1,Corporate Partnerships - January 2026
,,Main Line Bank & Trust,15000,2024-01-30,Main Line Bank Community Grant,Closed Won,Annual Fund 2024,Wire Transfer,Annual community investment grant supporting children's health initiatives,Account1,Corporate Partnerships - January 2026
,,Camden Legal Associates,10000,2024-03-20,Camden Legal Pro Bono Partnership,Closed Won,Annual Fund 2024,Check,Corporate partnership providing pro bono legal services and financial support,Account1,Corporate Partnerships - January 2026
,,South Jersey Medical Supply Co,20000,2024-04-10,SJ Medical Equipment Donation,Closed Won,Research Center Capital Campaign,In-Kind,In-kind donation of medical equipment and supplies for research center,Account1,Corporate Partnerships - January 2026
,,Delaware River Consulting Group,12000,2024-05-15,DRCG Employee Giving Campaign,Closed Won,Annual Fund 2024,Check,Annual employee giving campaign with corporate match,Account1,Corporate Partnerships - January 2026
,,Chester County Insurance Partners,8000,2024-06-01,CCIP Community Support Fund,Closed Won,Annual Fund 2024,Check,Corporate community investment supporting patient family programs,Account1,Corporate Partnerships - January 2026
